{
 "schema": "prism.stackup.a0",
 "present": false,
 "boardThicknessNm": 1600000,
 "layers": [],
 "copperLayers": [
  "F.Cu",
  "B.Cu"
 ],
 "maskColors": {},
 "viaSpans": [],
 "boardLayers": [
  {
   "ordinal": 0,
   "name": "F.Cu",
   "type": "signal"
  },
  {
   "ordinal": 2,
   "name": "B.Cu",
   "type": "signal"
  },
  {
   "ordinal": 5,
   "name": "F.SilkS",
   "type": "user",
   "userName": "F.Silkscreen"
  },
  {
   "ordinal": 7,
   "name": "B.SilkS",
   "type": "user",
   "userName": "B.Silkscreen"
  },
  {
   "ordinal": 1,
   "name": "F.Mask",
   "type": "user"
  },
  {
   "ordinal": 3,
   "name": "B.Mask",
   "type": "user"
  },
  {
   "ordinal": 13,
   "name": "F.Paste",
   "type": "user"
  },
  {
   "ordinal": 15,
   "name": "B.Paste",
   "type": "user"
  },
  {
   "ordinal": 25,
   "name": "Edge.Cuts",
   "type": "user"
  },
  {
   "ordinal": 31,
   "name": "F.CrtYd",
   "type": "user",
   "userName": "F.Courtyard"
  },
  {
   "ordinal": 29,
   "name": "B.CrtYd",
   "type": "user",
   "userName": "B.Courtyard"
  },
  {
   "ordinal": 35,
   "name": "F.Fab",
   "type": "user"
  },
  {
   "ordinal": 33,
   "name": "B.Fab",
   "type": "user"
  }
 ]
}
